"1","0","George Washington, ""The Father of Our Country"" fathered how many children?","History","",""
"1","Poppy","The sap of the ___ is the prime source of the drug opium.","Science","",""
"1","Porky Pig","This cartoon character's signature line was, ""Th-th-th-that's all folks!"".","TV","",""
"1","Porridge","Goldilocks ate the bear's ______.","Literature","",""
"1","Portugal","Antonio Salazar ruled this country ruthlessly from 1932-1968","History","",""
"1","Portugal","Prince Henry of ___ was noted as a sponsor of expeditions of discovery.","History","",""
"1","Portugal","What European country has an 8-letter name that ends in ""al""?","Geography","",""
"1","Possible","For what does the 'P' stand for in A.S.A.P. ?","Language","",""
"1","Possum","In the comic strip 'Pogo' what kind of animal is Pogo?","Literature","",""
"1","Potato","In 1530 this vegetable was discovered in the Andes and gave Europe a cheap food source. ","History","",""
"1","Potato","What is the English term for a ‘pomme de terre’?","Language","",""
"1","Potomac","In the US Civil War the Union Army was widely known as the 'Army of the ___'.","History","",""
"1","Poultice","A moist mass applied to a sore is called a ____.","Language","",""
"1","Pours","Provide the missing word.  'When it rains it _____.'","Language","",""
"1","Powder","Provide the missing word.   'Keep your _____  dry.'","Language","",""
"1","Praise","Complete the idiom: 'Damn with faint _____.'","Language","",""
"1","Preacher","Elmer Gantry's occupation was that of a _____. (8-letter word)","Literature","",""
"1","Predators","National Hockey League team name: 'Nashville _____'","Sports/Games","",""
"1","Prejudice","Complete the book title with one word. ""Pride and ____""","Literature","",""
"1","Present","Provide the missing word. 'There is no time like the ______.'","Language","",""
"1","President","The 22nd Amendment passed on Feb.26,1951, limiting the ______ to 2 terms in office.","Dates","",""
"1","Price","Provide the missing word. 'Every man has his ______.'","Language","",""
"1","Pride","Provide the collective noun. 'A ___ of lions.'","Science","",""
"1","Pride and Prejudice","Jane Austen's original title was 'First Impressions'. What was the final 3-word title?","Literature","",""
"1","Primates","Men, monkeys and apes are members of a mammalian group known as ___.","Science","",""
"1","Primates","To what 'order' of animals does 'man' belong?","Science","",""
"1","Prince","The song ""Some Day My ____ Will Come"" was introduced in the film ""Snow White & the 7 Dwarfs""","Film","",""
"1","Prince Edward Island","What is the smallest province in Canada?","Geography","",""
"1","Prince Edward Island","Which Canadian province is named for Prince Edward, Duke of Kent and Strathearn?","Geography","",""
"1","Prisoner of War","In the military what is a “POW”? ","Language","",""
"1","Prognosis","A medical prediction of the future course of a disease is called a ____.","Science","",""
"1","Progress","John Bunyan was the author of ""Pilgrim's ______"".","Literature","",""
"1","Prosper","Provide the missing word.  'Cheaters never _____.' (7-letter word)","Language","",""
"1","Protestant","For what does the 'P' stand in the acronym ""WASP""?","Language","",""
"1","Protractor","What common instrument is used to measure the size of an angle?","Science","",""
"1","Prunes","Dried plums are known as ____.","Geography","",""
"1","Psycho","A killer named Norman Bates appears in this film.","Film","",""
"1","Psychologist","On TV's ""The Bob Newhart Show"" Bob worked as a _____.","TV","",""
"1","PT 109","Name J.F.K.'s W.W.II torpedo boat.","History","",""
"1","Public","Provide the missing word. 'Do not wash your dirty linen in _____.'","Language","",""
"1","Public Relations","What do the letters stand for in a “P.R.” firm?","Business","",""
"1","Publicity","Provide the missing word.  'Any ______ is good publicity'","Language","",""
"1","Pudding","Provide the missing word.  'The proof of the _____ is in the eating.'","Language","",""
"1","Pumpkin","The godmother used a _____ to create a coach for Cinderella.","Literature","",""
"1","Pup","A baby seal is called a ____.","Science","",""
"1","Pupil","The black, central opening of the eye through which light enters is the ___.","Science","",""
"1","Purple","Book titles. Alice Walker's ""The Color _____""","Literature","",""
"1","Purse","Provide the missing word.  'You cannot make a silk ____ from a sow's ear.'","Language","",""
"1","Pursuit","What is the noun form of the word, 'Pursue'?","Language","",""
"1","Puzzle","A jig-saw is one type. (The answer is a 6-letter word and the third letter is 'z'.)","Language","",""
"1","Quality","Complete the Shakespearean phrase; ‘The _____ of mercy is not strain'd'.","Literature","",""
"1","Quartered","Provide the final word: ""Hung, drawn and ____""","Language","",""
"1","Quasimodo","The title character in 'The Hunchback of Notre Dame' is ____.","Literature","",""
"1","Que Sera, Sera","Identify the song: 'When I was just a little girl I asked my mother what will I be?'.","Music","",""
"1","Quebec","""_____ City"" is the capital city of the Province of Quebec.","Geography","",""
"1","Queeg","The captain in ""The Caine Mutiny"" was Captain ____.","Literature","",""
"1","Question.","Provide the missing word. 'There are two sides to every _____.'  (8-letter word)","Language","",""
"1","Quicksilver","Because of its fluid quality and color, mercury is sometimes called ___.","Science","",""
"1","Qwerty","What is the name for the most common keyboard arrangement of keys? ( 6 letter word)","Science","",""
"1","R","In the comics what is the letter on Archie's sweater?","Literature","",""
"1","R.A.F.","Never ...was so much owed by so many to so few'. Who were the 'few'? (3 letters)","History","",""
"1","R.A.F.","The British air force of WWII was known as the ___. (3 letters)","History","",""
"1","Rabbit","Playboy' magazine uses a ___ as a logo. ( 6 letters)","Literature","",""
"1","Rabies","North American bats and raccoons are noted carriers of this disease.","Science","",""
"1","Rabies","Provide the common name for the disease, 'Hydrophobia'.","Science","",""
"1","Raccoon","This mammals distinctive features are its extremely dexterous front paws and its facial mask.","Science","",""
"1","Raccoon","Three letters are missing from the name of this mammal. Provide the full name. ""_ _ ccoo _"".","Science","",""
"1","Racket","Analogy. Golf is to Club as Tennis is to ___.   ","Language","",""
"1","Radioactive","Because uranium gives off atomic particles it is said to be ____.","Science","",""
"1","Radium","On December 26,1898 Marie and Pierre Curie discovered ____. ( 6 letter word)","Dates","",""
"1","Radius","The distance from the center to the circle is called the ____.","Science","",""
"1","Raid","Commercials: What “kills bugs dead”? (4 letter word)","Business","",""
"1","Raiders","National Football League team: 'Oakland ____'","Sports/Games","",""
"1","Raiders of the Lost Ark","A quote from this film is, 'Snakes. Why did it have to be snakes?'. (5 word answer)","Film","",""
"1","Railroad","Folk song: ""I've Been Working on the ____"".","Arts/Culture","",""
"1","Rain","Provide the missing word.  'Into every life a little ____ must fall.'","Language","",""
"1","Rain Man","From what film is the line, 'I'm an excellent driver'?","Film","",""
"1","Rams","National Football League team:' St. Louis _____'","Sports/Games","",""
"1","Range","The distance between the highest and lowest note that a vocalist can sing is called his/her ____. (5 letter word)","Music","",""
"1","Rangers","American League baseball team: 'Texas _____'","Sports/Games","",""
"1","Raptors","National Basketball team name: 'Toronto _____'","Sports/Games","",""
"1","Ras Taffarians","Name the Jamaican sect that reveres Haile Selassie.","History","",""
"1","Rasputin","On December 30, 1916 mystic and holy man _____ was assassinated in Russia .","Dates","",""
"1","Raven","Poe's epitaph partially reads, 'Quoth the ______ nevermore'. ","Literature","",""
"1","Ravens","National Football League team: 'Baltimore____'","Sports/Games","",""
"1","Ray","On June 8,1968 James Earl _____, assassin of Martin Luther King, was arrested in London","Dates","",""
"1","Ray","The straight line along which light travels is called a ____. (3 letter word)","Science","",""
"1","Ray Orbison","Whose hits include 'Only the Lonely' and 'Oh Pretty Woman'? (Initials R.O.)","Music","",""
"1","Rays","American League baseball team: 'Tampa Bay ____'","Sports/Games","",""
"1","Read","Dyslexia impairs one's ability to ____. (4 letter word)","Science","",""
"1","Reagan","On Jan.2, 1988 Pres. _____ and P.M. Brian Mulroney signed the final version of the US-Can. trade accord","Dates","",""
"1","Reagan","Provide the surname of the US president: ""Ronald Wilson ____"".","People","",""
"1","Reagan","Who followed Jimmy Carter  as US President? (Surname only)","People","",""
"1","Reap","Provide the missing word. 'As you sow so shall you _____.'","Language","",""
"1","Red","""The ____ Sea"" lies between Africa and Asia.","Geography","",""
"1","Red","The Canadian flag is white and ____","Geography","",""
"1","Red","The FBI learned about Dillinger's whereabouts from a woman nicknamed 'The Woman in __'","History","",""
"1","Red","What color is the ""S"" on Superman's costume?","Literature","",""
"1","Red Baron","Manfred von Richthofen was nicknamed the _____. (2 words)","History","",""
"1","Red Ryder","His sidekick was ""Little Beaver"".","Literature","",""
"1","Red Sox","American League baseball team: 'Boston _____'","Sports/Games","",""
"1","Red Wings","National Hockey League team name:  'Detroit ____'","Sports/Games","",""
"1","Redemption","Complete the 3-word film title: (1994) ""The Shawshank ____""","Film","",""
"1","Reds","National League baseball team: 'Cincinnati _____'","Sports/Games","",""
"1","Redskins","National Football League team: 'Washington ____'","Sports/Games","",""
"1","Reich","The Nazis called their government the 'Third ____'.","History","",""
"1","Religious","On March 8,1948 the US Supreme Court ruled that ___  instruction in public schools was unconstitutional.","Dates","",""
"1","Renown","""Les Brown and his Band of ____""","Music","",""
"1","Repeat","Provide the missing word.  'Those who do not learn from history are doomed to _____ it. '","Language","",""
"1","Reptiles","Alligators are not mammals, they are ____.","Science","",""
"1","Residue","Any solid that remains on the filter paper after the process is complete is called the ___. (7 letter word)","Science","",""
"1","Restless","Complete the soap opera title: ""The Young and the ____""","TV","",""
"1","Revenue ","For what does the 'R' stand in the business abbreviation stand? ""IRS""","Business","",""
"1","Revolutionary","The ""Minutemen"" were active during the ""_____ War"".","History","",""
"1","Rhinoceros","The elephant is the largest land animal. What animal ranks second?","Science","",""
"1","Rhode Island","Which state of the USA is smallest in area?","Geography","",""
"1","Rhode Island ","What state of the U.S. is next alphabetically? Pennsylvania","Geography","",""
"1","Rhodes","""The Colossus of ____"" was one of the ""Seven Wonders of the Ancient World"".","History","",""
"1","Rib","What one 3-letter word can have both meanings? A curved bone...A teasing remark.","Language","",""
"1","Rice","From what is ‘sake’ made?   (4-letter word)","Art/Culture","",""
"1","Rice Krispies","Identify the cereal represented by three gnomes named Snap!, Crackle! and Pop!.","Business","",""
"1","Richard","Provide the missing name of the historical person. “_____ the Lionheart”","History","",""
"1","Richard","Robin Hood is loyal to the absent King ____.","Literature","",""
"1","Richard","What was the first name of Dr. Kimble on TV's 'The Fugitive'?","TV","",""
"1","Richard Burton","On March 15,1964 Elizabeth Taylor made this man, her 5th husband.","Dates","",""
"1","Richard Nixon","In 1972 Rose Mary Wood said she erased 18 minutes of this man's taped conversation. (Provide first and last name.) ","History","",""
"1","Richard Nixon","The famous 'Kitchen Debate' involved President _____. (Provide first and last name.) ","History","",""
"1","Richard Nixon","Who assured the public with the words, “I am not a crook”? (Initials R.N.)","People","",""
"1","Richard Nixon","Who said, ""This certainly has to be the most historic telephone call ever made""? (Provide first and last name.) ","History","",""
"1","Richter","The best known scale for measuring earthquake activity is the ____ scale.","Science","",""
"1","Ride","The works of Henry Wadsworth Longfellow include, ""Paul Revere's ____""","Literature","",""
"1","Rider","Anagrams: Rearrange all of the letters in the word to make another word. DRIER","Language","",""
"1","Rig","In 2010 the  ""Deepwater Horizon"" oil ____ exploded causing severe damage. (3 letter answer)","History","",""
"1","Right","Provide the missing word.  'Two wrongs do not make a _____.'","Language","",""
"1","Right","Provide the missing word. 'Whether you think you can, or you think you can't, you're _____.'","Language","",""
"1","Right","Use 1 word to complete the title of the TV series: ""The Price is ____"".","TV","",""
"1","Rings","The age of a tree can be determined by counting the annual ____.","Science","",""
"1","Rings","The author's name and the initials of the book title are given. Write the last word of the title.  J.R.R.Tolkien: T.L.O.T.R.","Literature","",""
"1","Ripley","In 'Alien' (1979) by what single name was Sigourney Weaver's character known?","Film","",""
"1","Ripper","The murderer who terrorized London in 1888-89 was known as ""Jack the ____""","People","",""
"1","Road","Title of a Robert Frost poem: ""The ___ Not Taken""","Arts/Culture","",""
"1","Road Runner","The ""______"" always manages to elude the ""Coyote"" in cartoon shows. (2 words)","TV","",""
"1","Robert De Niro","Who stars as aspiring comic Rupert Pupkin in 'The King of Comedy' (1983)?   (Provide first and last name.)","Film","",""
"1","Robert Ford","Jesse James was killed by ____. (Provide first and last name.) ","People","",""
"1","Robert Kennedy","Who was assassinated on June 5, 1968 in the USA?","Dates","",""
"1","Robert Redford","The 2 male leads of ""The Sting"" were  Paul Newman and ________.","Film","",""
"1","Roberts","Julia ____  turned down the Sharon Stone role in “Basic Instinct” and the female lead in “Shakespeare in Love"".","People","",""
"1","Rock","Provide the missing word from the title of an Elvis Presley film: “Jailhouse ___”","Film","",""
"1","Rockets","National Basketball team name: 'Houston ____'","Sports/Games","",""
"1","Rockies","National League baseball team: 'Colorado _____'","Sports/Games","",""
"1","Rockne","On March 31,1931 Knute ____ was killed in a plane crash.","Dates","",""
"1","Rocks","Provide the missing word. 'You must have ____ in your head.'","Language","",""
"1","Rocky","From what film is the quotation? ""Yo, Adrian!""","Film","",""
"1","Rocky Marciano","On August 31, 1969 champion boxer ___ was killed in a plane crash. (Initials R.M.)","Dates","",""
"1","Rod","Provide the missing word. 'Spare the ____ and spoil the child.'","Language","",""
"1","Rollerball","In this 1975 film James Caan is a star of a sport in a society where violence is outlawed.","Film","",""
"1","Romance","Languages that are derived from Latin are known as _____ languages.","Language","",""
"1","Romania","Ceausescu ruled this nation from 1967-1989 when he was deposed and executed.","History","",""
"1","Rome","Name the city in which the assassination occurred. 44 B.C.: Julius Caesar","Geography","",""
"1","Rome","Provide the missing word. 'All roads lead to ____.'","Language","",""
"1","Rome","What city is associated with the legendary twins Romulus and Remus?","Geography","",""
"1","Romeo","Identify the speaker: ‘But, soft! what light through yonder window breaks?'.","Literature","",""
"1","Romeo and Juliet","What play concerns the families named Montague and Capulet?","Literature","",""
"1","Ronald Reagan","What president is most closely associated with the term 'supply-side economics'? (Provide first and last name.) ","History","",""
"1","Ronald Reagan","Who was known as the 'Great Communicator'? (Provide first and last name.) ","History","",""
"1","Ronald Reagan","Who was the first man, having been divorced, to be elected as U.S. president? (Provide first and last name.) ","History","",""
"1","Roosevelt","Which of the 4 presidents depicted on Mount Rushmore was the most recent to serve? (Surname only)","History","",""
"1","Roosevelt","Who, in 1941 said, '....a date which will live in infamy'? (Surname only)","History","",""
"1","Rosa Parks","On December 1,1955 the Montgomery Bus boycott began when ___ refused to give up her seat. (Initials R.P.)","Dates","",""
"1","Rose Garden","Book title: ""I Never Promised You A ________"" (Two words)","Literature","",""
"1","Rose Marie","In what musical is the song, 'Indian Love Call'?","Music","",""
"1","Rosenberg","Julius and Ethel ___ were executed on June 19,1953 in Sing Sing Prison.","Dates","",""
"1","Rosenburgs","In 1950 this couple was charged with passing atomic bomb secrets to Soviet agents. (Last name only)","History","",""
"1","Rosetta Stone","This 'stone' enabled the Egyptian hieroglyphics to be understood for the first time.","History","",""
"1","Ross","Legend holds that Betsy ____ made the first 'Stars and Stripes'.","History","",""
"1","Ross Perot","In 1992 he promised to run for president if his name was put on ballots in all 50 states. (Initials R.P.)","History","",""
"1","Roswell","What town in New Mexico is noted as a center for UFO enthusiasts?","Science","",""
"1","Rough","Complete the idiom: 'Diamond in the ____.'","Language","",""
"1","Row","Two-word book titles. John Steinbeck's ""Cannery _____""","Literature","",""
"1","Roy","Complete the word pair: ""Siegfried and ___""","Language","",""
"1","Roy Rogers","What person with the double initials ""R.R."" was once married to Dale Evans?  ","People","",""
"1","Royals","American League baseball team: 'Kansas City ____'","Sports/Games","",""
"1","Rubicon","What river did Julius Caesar cross in order to fight Pompey?","History","",""
"1","Rubik’s Cube  ","What toy did Ernö Rubik create?","Business","",""
"1","Rudolph Valentino","On August 23,1926 sex symbol ____ died at age 31. (Initials R.V.)","Dates","",""
"1","Rules","Provide the missing word. '_____ were made to be broken.'","Language","",""
"1","Rules","Provide the missing word. 'The exception which proves the _____.'","Language","",""
"1","Rules","Provide the missing word. 'The hand that rocks the cradle ____  the world.'","Language","",""
"1","Rules","Provide the missing word. 'There is an exception to every _____.' ","Language","",""
"1","Rum","What daily ration for Royal Navy sailors was discontinued in July, 1970? (3 letter word)","Art/Culture","",""
"1","Run","What one 3-letter word can have both meanings?  To move quickly...A point scored in baseball.","Language","",""
"1","Runner","Two-word film title: ""Blade ____"" (1982)","Film","",""
"1","Russia","'Anastasia' was a princess of ____.","History","",""
"1","Russia","From what country did America buy Alaska?","History","",""
"1","Russia","On Feb.19, 1918 all land, farm buildings, machinery and livestock were nationalized in ___.","Dates","",""
"1","Russia","On October 17,1854 the 'Siege of Sebastopol' in this country began.","Dates","",""
"1","Russia","What country was ruled by Catherine the Great?","History","",""
"1","Russia","What country was ruled by Ivan the Terrible?","History","",""
"1","Russian","Coffee liqueur and vodka are the ingredients in the cocktail called a 'Black _____'.","Language","",""
"1","Russian","On November 7, 1917 the ____ revolution began.","Dates","",""
"1","Rust","Provide the missing word. 'Better wear out than ____ out'.","Language","",""
"1","Rusting","The corrosion of iron is called ____.","Science","",""
"1","Rye","Complete the book title with one word. ""The Catcher in the ____""","Literature","",""
"1","Rye","The author's name and the initials of the book title are given. Write the last word of the title. J.D. Salinger: T.C.I.T.R.","Literature","",""
"1","Sabres","National Hockey League team name:  'Buffalo ____'","Sports/Games","",""
"1","Sacramento","What is the capital city of California?","Geography","",""
"1","Safari","Apple calls its browser ""______"".","Science","",""
"1","Sahara","The ____ Desert is located in North Africa.","Geography","",""
"1","Saigon","What city was the capital of the former ""South Vietnam""?","History","",""
"1","Saigon","What was the former name of Ho Chi Minh city?","Geography","",""
"1","Saint Louis","The 'Gateway Arch' is located in _____, Mo.","Geography","",""
"1","Saints","National Football League team: 'New Orleans _____'","Sports/Games","",""
"1","Salesman","Arthur Miller title: ""Death of a ____"".","Literature","",""
"1","Sally","Provide the missing first name in the Little Richard song title: ""Long Tall ____""","Music","",""
"1","Salmon","This fish lives and feeds in sea water but spawns in fresh water. (6 letters)","Science","",""
"1","Salt Lake City","What is the capital city of Utah?","Geography","",""
"1","Sam","""Yosemite ____"" is an animated cartoon character in a series of cartoons.","TV","",""
"1","Samuel","Provide the author's first name: ___ Taylor Coleridge","Literature","",""
"1","Samurai","What was the name of the Japanese warrior class during the period 1603-1868?","History","",""
"1","San Francisco","On November 27,1978 the mayor and City Supervisor of this city were assassinated.","Dates","",""
"1","Sand","Use 1 word to complete the title of the popular song: 'Love Letters in the _____'.","Music","",""
"1","Sapling","Term for a young tree. (7 letters)","Science","",""
"1","Sarajevo","'Bosnia and Herzegovina' evolved out of the former Yugoslavia. What is its capital city?","History","",""
"1","Sarajevo","The assassination that sparked WWI took place in this city.","History","",""
"1","Saturday Night Fever","""How Deep is Your Love?"" and ""Stayin' Alive"" were introduced in the film ____. (3 word answer)","Film","",""
"1","Saturn","What is the sixth planet from the sun?","Science","",""
"1","Sauce","Anagrams: Rearrange all of the letters in the word to make another word. CAUSE","Language","",""
"1","Saudi Arabia","Ibn Saud was this country's first leader","History","",""
"1","Saudi Arabia","In what country is Mecca, the holy city of Islam?","Geography","",""
"1","Saul","Use 1 word to complete the title of the TV series: ""Better Call ____""","TV","",""
"1","Saul","Whom did David succeed as King of Israel?","History","",""
"1","Savings","Headlines covered the 'S and L' scandal of the 1980's. For what did the 'S' stand?","History","",""
"1","Say","Provide the missing word. ' Do as I ____, not as I do'.","Language","",""
"1","Scarum","Provide the missing word from the title of an Elvis Presley film: “Harum ___”","Film","",""
"1","Scent","Anagrams: Rearrange all of the letters in the word to make another word. CENTS","Language","",""
"1","Scorned","Provide the missing word. ' Hell hath no fury like a woman ______.'","Language","",""
"1","Scott","Who came in second in the race to the South Pole? (Surname only)","History","",""
"1","Screw","Anagrams: Rearrange all of the letters in the word to make another word. CREWS","Language","",""
"1","Scrooge","Wealthy ""_____ McDuck: is the maternal uncle of Donald Duck.","TV","",""
"1","Sea","Complete the book title with one word. ""The Old Man and the ____""","Literature","",""
"1","Sea","The agreed upon signal was, ""One if by land, and two if by ____"".","History","",""
"1","Seagull","Title of a best-seller: ""Jonathan Livingston _____"".","Literature","",""
"1","Seahawks","Provide the name of the bird used by the pro team.  ""Seattle _____""","Sports/Games","",""
"1","Season","Old Testament phrase: ""To everything there is a ____""","Literature","",""
"1","Seasons","Complete the title of the Best Picture Oscar winner for the year 1966: ""A Man for All ______""","Film","",""
"1","Seattle","National Football League team: ''______ Seahawks"".","Sports/Games","",""
"1","Secret","TV game show title: ""I've Got a ____""","TV","",""
"1","Seems Like Old Times","In 'Annie Hall' what song did Annie (Diane Keaton) sing at the nightclub? (4 word answer)","Film","",""
"1","Seen","Provide the missing word.  'Children should be ____ and not heard.'","Language","",""
"1","Seinfeld","On what TV show were the characters: Elaine Benes, George Costanza and Cosmo Kramer?","TV","",""
"1","Seinfeld","What TV series had an episode titled: “The Bubble Boy”?","TV","",""
"1","Seminoles","Identify the native Indians of Florida who were one of the 'Five Civilized Tribes'.","History","",""
"1","Senate","The U.S. Congress consists of 2 parts; the House of Representatives and the ____.","History","",""
"1","Senators","National Hockey League team name: 'Ottawa _____'","Sports/Games","",""
"1","Sense","Jane Austen's works include, ""________ and Sensibility""","Literature","",""
"1","Seoul","In 1951 this Asian capital city fell to Communist forces.","History","",""
"1","Served","Provide the missing word. ' First come, first ______.'","Language","",""
"1","Sesame Street","What popular children’s TV show first aired in 1969?  ( 2 words)","TV","",""
"1","Sexy","Rod Stewart song title of 1979: 'Do Ya Think I'm ____?'","Music","",""
"1","Shades ","Title of a 2011 novel: “Fifty  ____ of Grey”","Literature","",""
"1","Shadow","Song title: “The ___ of Your Smile”.         ","Music","",""
"1","Shangri-La","James Hilton created this fictional land.","Literature","",""
"1","Sharecropping","The post-slavery system of tenant farming was known as _____.","History","",""
