"1","0","George Washington, ""The Father of Our Country"" fathered how many children?","History","",""
"2","Guy Fawkes","In 1604 he attempted to blow up the English Parliament building. (Provide first and last name.) ","History","",""
"2","Guyana","On November 20,1978, 909 died in a mass suicide in Jonestown, ______.","Dates","",""
"2","Guyana","What is the only country in South America with English as its official language?","Geography","",""
"2","Guys and Dolls","From what 1955 film is the song? “Luck Be a Lady”.     ","Film","",""
"2","Guzzle","What word means: 'Drink greedily""?  (The answer is a 6-letter word and the third letter is 'z'.)","Language","",""
"2","Habeas Corpus","This historic act of law prevents people being imprisoned on mere suspicion. (2 words)","Language","",""
"2","Hadrian's","""______ Wall"" was built across Britain to protect Roman towns from attack.","History","",""
"2","Haines","It makes you “feel good all under”. (6-letter name)","Business","",""
"2","Hair","What part of the body is affected by ""Alopecia""?","Science","",""
"2","Haiti","Massive earthquake killed at least 230,000 in this island country in 2010.","Geography","",""
"2","Haiti","Name a country that begins with H and end with I.","Geography","",""
"2","Haley","The works of Arthur ____ include, ""Hotel"" and ""Airport"".","Literature","",""
"2","Halley","In 1705 Edmund ___ suggested that comets seen in 1531, 1607 and 1682 were all the same comet. ","Science","",""
"2","Hallmark","The official mark stamped on gold and silver articles is called the ___.","Language","",""
"2","Hallows","Harry Potter book title: ""Harry Potter and the Deathly  ________""","Literature","",""
"2","Hamelin","The Pied Piper of ______ lured rats in to the “Weser River”.","Literature","",""
"2","Hamlet","In a Shakespeare play his mother is Queen Gertrude.","Literature","",""
"2","Hamlet","In what play do these words appear? 'Rotten in the State of Denmark'.","Literature","",""
"2","Hamlet","In which of Shakespeare’s plays do Rosencrantz and Guildenstern appear? ","Literature","",""
"2","Hamlet","Ophelia is a character in Shakespeare's play "" ______"".","Literature","",""
"2","Hamlet","What is the only Shakespearean play to win the Best Picture Oscar?","Film","",""
"2","Hamlet","What Shakespearean character was described as 'The glass of fashion and the mold of form'?","Literature","",""
"2","Hamlet","What Shakespearean play opens with the words, 'Who's there?'","Literature","",""
"2","Hamlet","What was the longest play written by Shakespeare?","Literature","",""
"2","Handel","George Frederick ____ is noted for his ""Messiah"".","Arts/Culture","",""
"2","Hank Aaron","On April 8,1974 _______ beat Ruth's home run record by hitting number 715.  (Provide first and last name.)","Dates","",""
"2","Hannibal","Mark Twain spent his childhood in this Missouri town.","Literature","",""
"2","Hannibal","Who was the best known general of Carthage?","History","",""
"2","Happiness","Complete the quotation by Susan B. Anthony:  'Independence is ____ .'  (9-letter word)","People","",""
"2","Happy Birthday to You","Sisters Mildred and Patty Hill wrote this song in 1893. (4-letter title)","Music","",""
"2","Hardy","Mickey Rooney portrayed fictional teenager Andy _____ in an MGM film series from 1937 to 1946.","Film","",""
"2","Harem","Women’s trousers that are long, baggy and gathered at the ankle are called, ""____ pants"". (5 letter word)","Art/Culture","",""
"2","Harker","Jonathan ______ was the solicitor sent to do business with the count in 'Dracula'.","Literature","",""
"2","Harlequin","In Italian literature this character wears a black mask and a patched costume. (9-letter word)","Literature","",""
"2","Harmonica","What instrument is associated with Larry Adler?","Music","",""
"2","Harpo","_____ was the Marx Brother who never spoke.","Arts/Culture","",""
"2","Harriet Tubman","She was called the 'Moses of her people'. (Initials H.T.)","People","",""
"2","Harry Houdini","He lived from 1874-1926 and died of appendicitis on Halloween night. (Initials H.H.)","People","",""
"2","Harry Potter","He had a scar on his forehead shaped like a lightning-bolt. (Provide first and last name.) ","Literature","",""
"2","Hartford","What is the capital city of Connecticut?","Geography","",""
"2","Harvard","What university is situated at Cambridge, Massachusetts?","Geography","",""
"2","Haste","Provide the missing word. 'More ____. Less speed.'  (5-letter word)","Language","",""
"2","Hastings","The ""Battle of ______"" between the Normans and the Saxons took place in 1066.","History","",""
"2","Hat","In Gainsborough’s “Blue Boy” what is the boy holding in his right hand?","Art/Culture","",""
"2","Hathaway","Shakespeare's wife was named Anne ____.","Literature","",""
"2","Hats","A milliner makes or sells ___.","Language","",""
"2","Hatteras","""Cape ____"" is  called the 'Graveyard of the Atlantic'.","Geography","",""
"2","Hawkeye","When the Deerslayer kills his first man he becomes known by this name.","Literature","",""
"2","Hay","If wind-borne material produces systems of allergy the victim is said to have '_____ fever'.","Science","",""
"2","Hayward","Susan ____ starred in the 1955 film, ""I'll Cry Tomorrow"".","People","",""
"2","Hazard","An obstacle on a golf course. (The answer is a 6-letter word and the third letter is 'z') ","Language","",""
"2","He","What is the symbol for the element HELIUM?","Science","",""
"2","Head","Edith ____ won several Academy Awards for costume design. (4 letter surname)","People","",""
"2","Head","In what part of the sperm whale is the valuable 'sperm' found? (4-letter word)","Science","",""
"2","Health","For what does the 'H' stand in the acronym  ""WHO""?","Language","",""
"2","Hearst","William Randolph _____ was behind the screen career of actress Marion Davies.","People","",""
"2","Hearts","In a deck of playing cards which suit has the only king without a moustache?","Sports/Games","",""
"2","Heartwood","Older trees have 2 types of wood; sapwood and an inner, darker ____.","Science","",""
"2","Heat","Kathleen Turner's first film was, ""Body ____"".","Film","",""
"2","Hector","He was the eldest son of Priam and the noblest Trojan chieftain in Homer's 'Iliad'.","Literature","",""
"2","Helen of Troy","Who was, 'The face that launched 1000 ships'? (3 word answer)","History","",""
"2","Helicopters","With what type of transport is the name Sikorsky identified?","Science","",""
"2","Hell","William Tecumseh Sherman was known for saying, ""War is ____"".","History","",""
"2","Hemlock","The poison that Socrates drank was ____.","Science","",""
"2","Hemorrhage","In medicine 'bleeding' is usually known by this name.","Science","",""
"2","Hendrix","Jimmy_________, regarded as the most influential electric guitarist, died at age 27.","People","",""
"2","Henie","Sonia _____ was the only female figure skater to win 3 individual gold medals at the Olympics.","Sports/Games","",""
"2","Henry","What was the first name of Dr. Jekyll, the counterpart of Mr. Edward Hyde?","Literature","",""
"2","Henry  Stanley","Who found David Livingstone? (Provide first and last name.) ","People","",""
"2","Henry Hudson","What English explorer established the basis for the Dutch claims to New York? (Provide first and last name.) ","History","",""
"2","Hershey","It is, “The great American chocolate bar”. (7-letter name)","Business","",""
"2","Hey Diddle Diddle","In what nursery rhyme did the dish run away with the spoon? (3 word title)","Literature","",""
"2","Hibachi","Provide the English word of Japanese origin for a small, portable charcoal grill. (7 letters)","Language","",""
"2","High Lama","In 'Lost Horizon' 1937 Sam Jaffe portrays a character over 200 years old known as the ____. (2 words)","Film","",""
"2","High Noon","Two-Word Film Titles. Provide an antonym or inverse for each word to find the film title. ""Low Midnight""","Film","",""
"2","Hill","Provide the second name of the “2-name” organization. (Past or present)  ""McGraw ____""","Business","",""
"2","Hillary","Edmund ______ and Tenzing Norgay were the first 2 men to conquer ""Mount Everest"".","People","",""
"2","Hinckley","On June 21,1982 John ___ was found not guilty by reason of insanity for shooting Pres. Reagan.","Dates","",""
"2","Hindenburg","The German dirigible ____ exploded in 1937.","History","",""
"2","Hindsight","Provide the missing word.  ""_____ is always twenty-twenty""","Language","",""
"2","Hinduism","The 'Vedas' are the oldest sacred books of ____.","Literature","",""
"2","Hinny","A cross between a female donkey and a male horse is called a ___.","Science","",""
"2","Hippocratic","Historically physicians take the ""____ oath"".","Science","",""
"2","Hippopotamus","This animal's name literally means 'river horse'.","Science","",""
"2","Hirohito ","On November 10,1928 _____ was crowned emperor of Japan.","Dates","",""
"2","Hiroshima","On August 6,1945 an historic event took place in this city.","Dates","",""
"2","Hockey","In what sport is the term often used? ""Drop the gloves""","Sports/Games","",""
"2","Hoe","The poem, ""The Man with the ____""  begins, ""Bowed by the weight of centuries he stands "".","Literature","",""
"2","Holiday Inn","In what 1942 film was the song 'White Christmas' introduced? (2 word title)","Film","",""
"2","Holland","On November 13,1927 the ""_____ Tunnel"" opened linking New York and New Jersey.","Dates","",""
"2","Hollywood Squares","On the TV show, "" ___ "", 9 celebrities appeared in a tic-tac-toe board. (2 word title)","TV","",""
"2","Home, Sweet Home","This song's lyrics include, ""Be it ever so humble, there's no place like home"". (3 words)","Arts/Culture","",""
"2","Homo sapiens","Man is a member of this species. (2 words)","Science","",""
"2","Homosexual","Oscar Wilde was imprisoned after being convicted of ____ practices.","Literature","",""
"2","Homosexuality","'The Boys in the Band' (1970) is an honest film dealing with the subject of ___.","Film","",""
"2","Honda","Name the brand of car that produced a model known as: ""Odyssey"".","Business","",""
"2","Honey","In a 2011 film Winnie the Pooh wakes up to find that he is out of ____.","Film","",""
"2","Honey","What food product is classified as white, golden, amber or dark?","Language","",""
"2","Honeymooners","""The ____""  TV show featured a bus driver and a sewer worker.","TV","",""
"2","Hong Kong","The ""Treaty of Nanking"" ceded the island of ""______"" to the United Kingdom.","History","",""
"2","Hoover","Who directed the FBI for 48 years? (Surname only)","People","",""
"2","Hoover ","What vacuum used the slogan? ""It beats as it sweeps as it cleans""","Business","",""
"2","Hopalong Cassidy","This cowboy star's standard bar order in films was ""milk"".  (Initials H.C.)","People","",""
"2","Horatio Nelson","What leader was killed at the “Battle of Trafalgar”? (Initials H.N.)","History","",""
"2","Horatio Nelson","Who was Lady Emma Hamilton’s famous lover?  (Provide first and last name.) ","People","",""
"2","Horatio Nelson","Who, in 1805 wrote to Emma Hamilton expressing final words of endearment? (Initials H.N.)","People","",""
"2","Horizon","Use 1 word to complete the title of the popular song: ""Beyond the Blue ______""","Music","",""
"2","Horn","""Cape ____"" is separated from Antarctica by the 'Drake Passage'.","Geography","",""
"2","Horn","A double play which goes from the 3rd baseman to 2nd to 1st is called ""Around the _____"".","Sports/Games","",""
"2","Horn","What one word applies to both?  An automobile and a rhinoceros. (4 letter word)","Language","",""
"2","Horse","What is an 'appaloosa'? (5-letter word)","Language","",""
"2","Horseshoe","The 2 falls at Niagara Falls are the American Falls and the ""____ Falls"".","Geography","",""
"2","Houdini","American escape artist Harry _____ died of a ruptured appendix after a punch in the stomach.","People","",""
"2","House","""Random _____"" and ""Doubleday"" are book publishers.","Business","",""
"2","House","Henrik Ibsen title, “The Doll’s ____”.","Literature","",""
"2","House","The TV series 'Three's Company' was based on the British series, ""Man About the ____"".","TV","",""
"2","House ","The title of the sequel to 'Winnie the Pooh' was "" The _____ at Pooh Corner"".","Literature","",""
"2","House of Lords","The non-elected body of the U.K. legislature is the ____. (3 words)","History","",""
"2","Howard Hughes","What man was responsible for building the ""Spruce Goose""? (Initials H.H.)","Science","",""
"2","Hoya","Oscar De La ____ was a boxer nicknamed ""The Golden Boy"". (4 letter name)","People","",""
"2","Hudson","In 2009 US Airways Flight 1549 crash landed in the ""_____ River"".","History","",""
"2","Human Torch","This flaming superhero gained attention when he became a member of Marvel's Fantastic Four. (2 words)","Literature","",""
"2","Humboldt","The cold ""______ Current"" flows north along the coasts of Chile and Peru to Ecuador.","Geography","",""
"2","Humidity","What does an 'hygrometer' measure?","Science","",""
"2","Humphrey Bogart","He topped the 'American Film Institute's' list of the 10 greatest American screen legends. (Initials H.B.)","Film","",""
"2","Hungary","The local name for the country is 'Magyarország'. What is the common name? ","Geography","",""
"2","Hungary","What European country has a 7-letter name that ends in ""ry""?","Geography","",""
"2","Hungary","Which country is associated with 'Paprika'?","Geography","",""
"2","Hurricanes","“Sandy”, “Irene” and “Wilma” are all retired names of _____.","Science","",""
"2","Hurricanes","National Hockey League team name: 'California ____'","Sports/Games","",""
"2","Hush Puppies","A sad-looking basset hound was used in ads for this brand of footwear. (2 words)","Business","",""
"2","Hyde","David ___ Pierce played Dr. Frasier Crane's brother, Dr. Niles Crane on 'Frasier'.","TV","",""
"2","Hydrogen","Henry Cavendish discovered this gas which he called 'inflammable air'.","Science","",""
"2","Hydrogen","What gas provided the lift for the 'Hindenburg'?","History","",""
"2","Hydrogen sulphide","What gas is known for its smell of rotten eggs? (2 words)","Science","",""
"2","Hypertension","The one-word term for 'very high blood pressure' is ______.","Science","",""
"2","Hypothermia","What is the term for 'low body temperature'?","Science","",""
"2","I am a Berliner","Translate the phrase, 'Ich bin ein Berliner'. (4 words)","History","",""
"2","I Love Lucy","On what TV series was the locale of significance?  The “Club Tropicana”   ( 3 words)","TV","",""
"2","I Love You","Title of a Stevie Wonder song: ""I Just Called to Say _____"". (3 words)","Music","",""
"2","Iago","He causes Othello to kill his faithful wife.","Literature","",""
"2","Icarus","Who flew too close to the sun?","People","",""
"2","Iceland","The 'Cod War' (1972-76) was between Great Britain and ____.","History","",""
"2","Iceland","The short, local name for the country is ""Island"". What is the common name? ","Geography","",""
"2","Iceland","What country would come next in an alphabetical list? Hungary","Geography","",""
"2","Iceland","What is the most sparsely populated country in Europe?","Geography","",""
"2","Iceland","What is the only member of NATO that doesn't maintain a standing army?","Geography","",""
"2","Iceman","The works of Eugene O'Neill include, ""The ______ Cometh.","Literature","",""
"2","Id","If the ego is the conscious mind, what is the unconscious mind with hidden desires?","Science","",""
"2","Ides","In the ancient Roman calendar March 15 was known as the ""____ of March"".","History","",""
"2","If","What poem ends with the words, 'And - which is more - You'll be a man, my son!'?","Literature","",""
"2","Ignoramuses","What is the plural form of 'Ignoramus'?","Language","",""
"2","Immune","For what does ""I"" stand for in the acronym ""AIDS""?","Language","",""
"2","Impotence","E.D.' stands for erectile dysfunction. It is more commonly known as ___. (9-letter word)","Science","",""
"2","In Cold Blood","Identify Truman Capote's novel about the Clutter family killings in Kansas. (3 words)","Literature","",""
"2","In love.","Complete the quotation by Albert Einstein: 'You can’t blame gravity for falling ____' (2 words)","People","",""
"2","In the beginning","What are the first 3 words of the Book of Genesis?","Literature","",""
"2","Incest","Oedipus blinded himself for the crimes of patricide and ____.  (6 letters)","Literature","",""
"2","Independence","""_____ Hall"" in Philadelphia is where the ""Liberty Bell"" is found.","Arts/Culture","",""
"2","India","In 2007 Pratibha Patil became the first woman to be elected President of _____.","People","",""
"2","India","On August 15, 1947 ___ gained its independence from Britain.","Dates","",""
"2","India","What country would come next in an alphabetical list? Iceland","Geography","",""
"2","India","What democratic country has the largest population?","Geography","",""
"2","Indira Ghandi","Two Sikh bodyguards assassinated this leader on Oct.31, 1984. (Provide first and last name.) ","History","",""
"2","Indonesia","What country would come next in an alphabetical list? India","Geography","",""
"2","Inert","Gases that don't easily form compounds are said to be ____. (5-letter word)","Science","",""
"2","Inertia","The properties shown by matter in resisting a change in speed or direction is called ___. (7 letters)","Science","",""
"2","Infer","Provide a 5-letter word meaning, ""conclude by reasoning"".","Language","",""
"2","Ink","What one word applies to both?   A pen and an octopus. (3 letter word)","Language","",""
"2","Ink blot","The 'Rorschach Test' is commonly called the _____test. (2 words)","Science","",""
"2","Instruments","""A cappella is choral singing performed without ____.   (11- letter word)","Art/Culture","",""
"2","Insulin","On Jan.11,1922 diabetic Leonard Thompson was first to be treated successfully with ___.","Dates","",""
"2","Intel","What company invented the Pentium processor? (5-letter name)","Science","",""
"2","Intestines","The ailment 'colitis' affects the ____. (10 letter plural word)","Science","",""
"2","Invention","Complete the quotation: 'Woman's virtue is man's greatest _____'.","Language","",""
"2","Iodine","Goiters develop when the body does not supply the thyroid gland with enough ___. (6 letter word)","Science","",""
"2","Iodine","The symbol ""I"" is for the element _____.","Science","",""
"2","Ionic","The three basic orders of ancient Greek architecture are: Corinthian, Doric and _____.","Art/Culture","",""
"2","Iowa","Des Moines is the capital city of _____.","Geography","",""
"2","Ipanema","The 2 famous beaches in Rio de Janeiro are Copacabana and ____.","Geography","",""
"2","Iran","What country would come next in an alphabetical list? Indonesia","Geography","",""
"2","Ireland","What country would come next in an alphabetical list? Iraq","Geography","",""
"2","Irma","Hurricane ""Harvey"" of 2017 was followed by hurricane _____. (4 letter word)","Science","",""
"2","Iron","The term 'ferrous' means relating to ____. (4 letter word)","Science","",""
"2","Iroquois","In 1570, 5 tribes; Mohawk, Oneida, Onondaga, Cayuga and Seneca formed the "" _____ League"".","History","",""
"2","Iroquois","The 'Five Nations' was the name given to the ""_____ Confederation"".","History","",""
"2","Isaac","Who was the son Abraham was prepared to sacrifice at God's request?","Literature","",""
"2","Isaac Asimov","This writer, scientist coined the term 'robotics'. (Initials I.A.)","People","",""
"2","Isaac Newton","___ stated that at 1-ft the attraction between 2 objects was 100 times that at 10 ft. (Initials I.N.)","Science","",""
"2","Iscariot","What was the last name of the Biblical ""Judas""?","Literature","",""
"2","Ishmael","The narrator's name in the novel 'Moby Dick' was ____.","Literature","",""
"2","Islam","What religion is associated with the “Qur’an”? (5 letter word)","Language","",""
"2","Island","Benchley wrote 'Jaws' and 'The Deep' and in 1978 he wrote 'The ___'. (6 letter title)","Literature","",""
"2","Isolationism","The belief that a nation's interests are served by minimal foreign involvement is called _____. (12 letter word)","History","",""
"2","Israel","What country would come next in an alphabetical list? Ireland","Geography","",""
"2","Istanbul","In what city is Topkapi Palace?","Geography","",""
"2","It drizzles","Cole Porter song lyric: 'I love Paris in the winter when ______'. (2 words)","Music","",""
"2","Italy","What country is known as ""The Land of the Apennines""","Geography","",""
"2","Italy","What country is most closely associated with the dance called a ""Tarantella""?","Geography","",""
"2","Italy","What country would come next in an alphabetical list? Israel","Geography","",""
"2","Ivanhoe","This hero of Sir Walter Scott's novels marries Rowena.","Literature","",""
"2","Ivanka Trump","Who married Jared Kushner in 2009?  (Provide first and last name.) ","People","",""
"2","I've Got a Secret","On this TV game show 4 panelists had to discover the secret of the contestant. (4 letters)","TV","",""
"2","Jack","First you put your two knees close up tight' is from the song, ""Ballin' the ____"".","Music","",""
"2","Jack Benny","Who used the song 'Love in Bloom' as his theme song? (Initials J.B.)","Music","",""
"2","Jack Lemmon","In the 1982 film 'Missing' who portrayed Ed Horman who is searching for his son?  (Provide first and last name.)","Film","",""
"2","Jack London","This American author at the age of 40, beset by alcoholism, committed suicide in 1916. (Initials J.L.)","People","",""
"2","Jack London","Who was the first American author to earn a million dollars through his writings? (Initials J.L.)","Literature","",""
"2","Jack Nicholson","At age 37 this actor discovered that the woman he'd thought was his sister was his mother. (Initials J.N.)","People","",""
"2","Jack Nicholson","His 17-year relationship with Angelica Houston ended in 1990. (Initials J.N.)","People","",""
"2","Jackal","The 1971 novel ""The Day of the ___"" by F. Forsyth is about a plot to murder French president Charles De Gaulle","Literature","",""
"2","Jackson","Who followed John Quincy Adams as US President. (Last name only needed.)","People","",""
"2","Jacob","Provide the person’s middle name. John ____ Astor","People","",""
"2","Jamaica","An island name completes the lyric: “I took a trip on a sailing ship, and when I reached ____ I made a stop”","Music","",""
"2","Jamaica","Complete the book title with the name of a ‘country’. “______ Inn” by Daphne du Maurier","Literature","",""
"2","James Dean","Who starred in both, “East of Eden” and “Rebel Without a Cause”?","Film","",""
"2","James Hoffa","The middle name of this American who disappeared in 1975 was 'Riddle'. (Initials J.H.)","People","",""
"2","James Joyce","He wrote 'Finnegan's Wake' and he died of a perforated ulcer in 1941. (Provide first and last name.) ","Literature","",""
"2","Jane Eyre","In what novel are the lines found? “Mr. Rochester continued blind the first two years of our union” (2 word title)","Literature","",""
"2","January","Analogy. Summer is to Spring as February is to ___.","Language","",""
"2","January","In what month of the year is the Earth closest to the sun?","Science","",""
"2","Japan","During the years 1549-52 Francis Xavier introduced Christianity to ____.","History","",""
"2","Japan","Flying due west from New York City the first Asian country reached is ___.","Geography","",""
"2","Japan","The Ainu are an indigenous people of this country.","Geography","",""
"2","Japan","What country would come next in an alphabetical list?  Jamaica","Geography","",""
"2","Japan","What country's ""Imperial Seal"" is a Chrysanthemum?","Geography","",""
"2","Jar","Complete the title of the novel: ""The Bell _____ ""  (3-letter word)","Literature","",""
"2","Jason","What name is spelled by the first letters of the months July through to November inclusive?","Language","",""
"2","Jealousy","Shakespeare called this, 'The green-eyed monster'.","Literature","",""
"2","Jeanie","Stephen Foster wrote a song about this girl with, “Light Brown Hair”.","Music","",""
"2","Jeckle","Two popular cartoon magpies were named Heckle and ____.","TV","",""
"2","Jeff Daniels","The 2 male leads of ""Dumb and Dumber"" were Jim Carrey and _______.","Film","",""
"2","Jefferson","What president presided over the Louisiana Purchase?","History","",""
"2","Jehovah's Witnesses","The ___ were incorporated as the 'Watch Tower Bible and tract Society of Pennsylvania' (2 words)","History","",""
"2","Jennifer","Provide the same first name of the celebrities with surnames, Hudson and Aniston.","People","",""
"2","Jenny Lind","Who was nicknamed the ""Swedish Nightingale""? (Initials J.L.)","People","",""
"2","Jersey Joe Walcott","______ was the only person to lose 3 consecutive heavyweight title fights. (1947, 1948, 1949)    (Initials J.J.W.)","People","",""
"2","Jesse Jackson","This political guest on SNL read Dr. Seuss's 'Green Eggs and Ham'. (Initials J.J.)","TV","",""
"2","Jesse Ventura","This former wrestler known as 'The Body' became Governor of Minnesota. (Initials J.V.)","People","",""
"2","Jesus Christ","Because they can sprint across water young basilisk lizards are also called ____ lizards. (2 words)","Science","",""
"2","Jethro Tull","Ian Anderson was the lead singer of this group which produced the album, 'Aqualung'. (Initials J.T.)","Music","",""
"2","Jetsam","What is the term for objects thrown overboard?","Language","",""
"2","Jew","A 'Gentile' is someone who is not a ____.","Literature","",""
"2","Jihad","Five-letter term for a holy war that Muslims take part in to defend Islam.","Language","",""
"2","Jimmy Buffett","This singer-songwriter's signature tune is 'Margaritaville'. (Initials J.B.)","Music","",""
