"1","0","George Washington, ""The Father of Our Country"" fathered how many children?","History","",""
"1","0","How many handles are there on a goblet?","Language","",""
"1","0.5","The fraction one-half expressed as a decimal is ___.","Science","",""
"1","1","How many days does it take the Earth to spin once on its axis?","Science","",""
"1","1","The only two digits in the binary system are 0 and ___.","Science","",""
"1","2","US presidents are limited to serve no more than ___ terms of office.","History","",""
"1","3","How many times did Scarlett O'Hara marry in G.W.T.W.?","Literature","",""
"1","3","Insects have six legs and a body divided into ___ parts.","Science","",""
"1","4","How many chambers does the human heart contain?","Science","",""
"1","4","How many ghosts visited Scrooge in 'A Christmas Carol'?","Literature","",""
"1","4","How many stages are there considered to be in the life cycle of a butterfly?","Science","",""
"1","4","How many strings does a regular violin have?","Music","",""
"1","4","In baseball how many balls make a 'walk'?","Sports/Games","",""
"1","4","US president are elected to serve a ___ year term.","History","",""
"1","5","How many side are there on a 'home plate'?","Sports/Games","",""
"1","5","The Lincoln Memorial' is pictured on the back of the U.S. ____dollar bill.","Geography","",""
"1","5","What is the remainder when you subtract the number of 'Days in a week' from the number of  'Months in a year?","Science","",""
"1","6","A pool table has ___ pockets.","Sports/Games","",""
"1","6","How many categories of questions are there I,n “Trivial Pursuit”?","Sports/Games","",""
"1","6","How many legs does an insect normally have?","Science","",""
"1","6","How many players make up an ice- hockey team?","Sports/Games","",""
"1","6","How many sides does a snowflake have?","Science","",""
"1","6","How many white stripes are on the U.S. flag?","History","",""
"1","7","Earth is the third planet from the sun. Uranus is the ___th planet from the sun. (A numeral)","Science","",""
"1","7","How many stars are there in the Big Dipper?","Science","",""
"1","8","How many legs do arachnids have?","Science","",""
"1","8","How many planets are there in our Solar System?","Science","",""
"1","8","How much is 4 divided by one-half?","Science","",""
"1","9","How many U.S. Supreme Court Justices are there?","History","",""
"1","9","Provide the missing number of the poetic line. “It looked extremely rocky for the Mudville ___ that day”.","Literature","",""
"1","10","Diving judges score each dive with a possible range of scores from 1 to __.","Sports/Games","",""
"1","10","How many plagues did Moses release on Egypt through the power of God?","Art/Culture","",""
"1","10","How many provinces are there in Canada?","Geography","",""
"1","12","There are ___ face cards in a regulation card deck.","Sports/Games","",""
"1","13","How many is a ""baker's dozen""?","Language","",""
"1","13","How many live figures are portrayed in Leonardo da Vinci's ""The Last Supper""?","Arts/Culture","",""
"1","13","The first official American flag (1776) had 13 stripes and ___ stars.","History","",""
"1","13","When the U.S. 'Declaration of Independence' was signed there were __ states.","History","",""
"1","14","How many nights are in a fortnight?","Language","",""
"1","14","What number is XIV?","Art/Culture","",""
"1","19","What number is the sum of: Days in a week + Months in a year?","Science","",""
"1","20","Provide the missing number of the poetic line. “Now of my threescore years and ten, ____ will not come again.”","Literature","",""
"1","20","The White House' is pictured on the back of the U.S. ____ dollar  bill.","Geography","",""
"1","21","By what number is ""Blackjack"" also known?","Art/Culture","",""
"1","24","If each time zone were 1 hour apart, there would be ___ in the world.","Science","",""
"1","30","How many pieces of silver did Judas receive in payment?","Literature","",""
"1","32","The normal adult has ___ permanent teeth.","Science","",""
"1","39","Jack Benny always gave this number as his age.","People","",""
"1","48","How many contiguous states are there in the United States?","Geography","",""
"1","48","How many stars were on the U.S. flag in 1954 when Nov.11 officially became Veteran's Day?","History","",""
"1","49","How many of the states of the United States are in North America?","Geography","",""
"1","60","What number is the sum of: The Biblical Commandments + U.S. States?","Science","",""
"1","61","Roger Maris hit ___ homers to break Ruth's single season record.","Sports/Games","",""
"1","64","How many small squares are there on a chessboard?","Sports/Games","",""
"1","75","If an item is 18 karats what percentage is the gold content?","Science","",""
"1","80","Provide the missing number of the Jules Verne title; ‘Around the World in __ Days'. (provide a numeral)","Literature","",""
"1","80","What number is the sum of: Dimes in 2 dollars + Minutes in an hour?","Science","",""
"1","100","How many yards is it from goal line to goal line in American football?","Sports/Games","",""
"1","150","There are ____ seconds in 2.5 minutes.","Geography","",""
"1","180","A 'straight angle' equals ___ degrees.","Science","",""
"1","180","If 2 adjacent angles form a straight line what is their sum in degrees?","Science","",""
"1","180","The sum of the angles in a triangle is ___ degrees.","Science","",""
"1","600","How many rode into the valley of death in 'The Charge of the Light Brigade'?","Literature","",""
"1","600","Provide the missing number of the poetic line. “All in the valley of Death, rode the ______.”","Literature","",""
"1","666","In the Bible what is the number of the 'Beast'?","Literature","",""
"1","1492","Columbus discovered America in the year ____.","History","",""
"1","1776","In what year was the ""Declaration of Independence"" written?","History","",""
"1","1912","The 'Titanic' sank in the year ___.","History","",""
"1","1917","'The Great War' lasted from 1914-1918. In which year did the USA enter the war?","History","",""
"1","1984","No. 6079, Winston Smith, was the main character in this George Orwell novel. (Use numerals for the answer)","Literature","",""
"1","2000","What is the rent in dollars for a hotel on Boardwalk in the game of Monopoly?","Sports/Games","",""
"1","49ers","National Football League team: San Francisco _____","Sports/Games","",""
"1","76ers","National Basketball team name: Philadelphia _____.","Sports/Games","",""
"1","A","What letter was 'The Scarlet Letter'?","Literature","",""
"1","A Tale of Two Cities","In what novel are the words, 'It was the best of times, it was the worst of times...'? (5 word title)","Literature","",""
"1","A Tale of Two Cities","In what novel would you find Charles Darnay and Madame Defarge? (5 word title)","Literature","",""
"1","A Tale of Two Cities","This novel ends with, ‘It is a far, far better thing that I do, than I have ever done.....' (5 word title)","Literature","",""
"1","Abbey","Jane Austen's works include, ""Northanger _____"".","Literature","",""
"1","Abraham","His willingness to sacrifice his son Isaac proved his devotion to God.","Literature","",""
"1","Absence","Provide the missing word. ""____ makes the heart grow fonder"".","Language","",""
"1","Accidents","Provide the missing word.  '____ will happen in the best-regulated families'.","Language","",""
"1","Accountant","What professional person is called a “number cruncher”? (1 word)","Language","",""
"1","Acid","An ____ changes litmus paper to red.","Science","",""
"1","Acid","In chemistry the opposite of a 'base' is an ____.","Science","",""
"1","Acorns","Provide the missing word. ""Mighty oaks from little _____ grow"".","Language","",""
"1","Act","What one 3-letter word can have both meanings?  Part of a play...A single thing that one does.","Language","",""
"1","Adams","John _____followed George Washington as US President.","People","",""
"1","Aesop","_____ is credited as the writer/collector of many famous ‘fables’.","Literature","",""
"1","Africa","Asia is the continent with the most people. What continent ranks second?","Geography","",""
"1","Africa","Asia is the largest continent. What continent is next in size?","Geography","",""
"1","Africa","Carthage' was a major city of ancient history. On what continent was it located?","History","",""
"1","Africa","Complete the title of the Best Picture Oscar winner for the year 1985: ""Out of _____""","Film","",""
"1","Agatha Christie","She raised the ""whodunit"" genre to new heights in literature. (Initials A.C.)","Literature","",""
"1","Agatha Christie","Who created the fictional detective, Miss Marple?","Literature","",""
"1","Agent","In the 1996 film ""Jerry Maguire"" Tom Cruise worked as a sports ____. (5 letters)","Film","",""
"1","Air force","Hermann Goering was in charge of the German _____ during WWII.  (2 words)","History","",""
"1","Airplane","You would most likely experience 'turbulence' while in an _____. (8 letter word)","Language","",""
"1","Airplanes","Name the specific product generally associated with ""Cessna"" and ""Lockheed""","Business","",""
"1","Al Jolson","On October 6,1927 'The Jazz Singer' starring ___, opened in New York City.","Art/Culture","",""
"1","Alamo","The Texan battle cry was, 'Remember the ___'.","History","",""
"1","Alaska","In which state is the largest legally established county?","Geography","",""
"1","Alaska","On March 30,1867 the United States purchased______.","Dates","",""
"1","Alaska","What state of the U.S. is next alphabetically? Alabama","Geography","",""
"1","Alaska","What US state uses the abbreviation AK?","Geography","",""
"1","Alaska","Which U.S. state borders a Canadian 'Territory'?","Geography","",""
"1","Alaska","Which U.S. state has the largest number of active volcanoes?","Geography","",""
"1","Albert ","What was the first name of the famous physicist, Einstein?","Science","",""
"1","Alcatraz","Complete the film title with a word ending in “z”. Escape from ____ (1979)","Film","",""
"1","Alcoholic","During the 'Prohibition Era' it was illegal to buy ____ beverages. (9 letter word)","Language","",""
"1","Aldrin","The first 2 people to walk on the moon were Neil Armstrong and Buzz _____.","History","",""
"1","Alexandria","""The Pharos of _____"" was one of the ancient 'Wonders of the World' .","History","",""
"1","Alice","The most famous character created by author Lewis Carroll was named ____.","Literature","",""
"1","Alimony","Money paid for the support of a former spouse is called _____. (7 letter  word)","Language","",""
"1","All","The last word of the American 'Pledge of Allegiance' is ____.","History","",""
"1","All in the Family","Archie Bunker and his daughter Gloria were characters on this TV show. (4 words)","Film","",""
"1","All in the Family","Name the TV series that used the theme song: ""Those Were The Days"".  (4 words)","TV","",""
"1","All in the Family","What TV series had an episode titled: ""Archie Gives Blood”?   ( 4 words)","TV","",""
"1","Allah","The 'god' of the Muslim religion is called ____.","Language","",""
"1","Alliteration","The repetition of beginning sounds as in 'fickle finger of fate' is called an ____.","Language","",""
"1","Alloys","Combinations of metals such as bronze are known as ____.","Science","",""
"1","Allstate","What insurance company puts you ""in good hands""?","Business","",""
"1","Alone","Two-word film title: ""Home ___"" (1990)","Film","",""
"1","Amadeus","What was the middle name of the composer Mozart?","People","",""
"1","Amazon","Based on discharge of water what is the largest river in the world?","Geography","",""
"1","Amazon","The second longest river, after the Nile, is the ____.","Geography","",""
"1","Amen","The final episode of M*A*S*H, broadcast on February 28,1983, was titled, ""Goodbye, Farewell & ____"".","TV","",""
"1","Amen","What word is normally spoken at the end of a Christian prayer?","Language","",""
"1","America the Beautiful","What song opens with, 'O beautiful for spacious skies'? (3 words)","Music","",""
"1","American Express","Provide the name of the organization that used the quotation: “Don’t leave home without it.”","Business","",""
"1","Amnesia","The inability to remember past experiences is called ___.","Science","",""
"1","Amoco","What is the 5-letter acronym for "" American Oil Company""?","Business","",""
"1","Amphibians","Frogs, toads, salamanders and newts are members of this class of animals.","Science","",""
"1","Amundsen","On September 2,1906 Raold ___ completed the Northwest Passage.","Dates","",""
"1","Amundsen","Who was the first to reach the South Pole? (Surname only)","History","",""
"1","An American in Paris","This 1951 musical starring Gene Kelly and Leslie Caron won the Best Picture Oscar. (4 words)","Film","",""
"1","Andrews","In the comics what is 'Archie's' last name?","Literature","",""
"1","Andy","Walter Lanz created a cuddly cartoon character named ""____ Pandy"".","Art/Culture","",""
"1","Angel","""____ Falls"" is considered the world's highest waterfall.","Geography","",""
"1","Angels","American League baseball team: 'Los Angeles _____'","Sports/Games","",""
"1","Angels","Provide the missing word.  ""Fools rush in where _____ fear to tread"".","Language","",""
"1","Angle","A 'protractor' is used to measure an _____.","Science","",""
"1","Animal Farm","In what novel is, ""All animals are created equal, but some are more equal than others""?","Literature","",""
"1","Anna","What was the first name of the character who was the 'I' in ""The King and I"" film?","Film","",""
"1","Annie","What Broadway musical featured the songs, ""Tomorrow"" and ""Easy Street""?","Music","",""
"1","Annie Hall","From what film is the quotation? ""La-dee-da, la-dee-da.""","Film","",""
"1","Another","Provide the missing word.   ""One good turn deserves ______"".","Language","",""
"1","Answer","Provide the missing word.  ""Ask a silly question and you will get a silly _____"".","Language","",""
"1","Antarctica","The most southerly continent is ____.","Geography","",""
"1","Antarctica","The only continent that was truly 'discovered' is _____.","Geography","",""
"1","Antique","A piece of furniture that is old but valuable is an ____. (7 letters)","Language","",""
"1","Antlers","'Deer' are the only animals that grow ___.","Science","",""
"1","Anymore","Use 1 word to complete the title of the popular song: ""Don't Get Around Much _____"".","Music","",""
"1","Apollo 11","On July 20,1969 Armstrong and Aldrin walked on the moon during this mission.","Dates","",""
"1","Apple","Provide the missing word.  ""The ____ never falls far from the tree"".","Language","",""
"1","Apple","What company introduced the translucent 'iBook'?","Science","",""
"1","Apple","What company or product used the slogans? “Think Different” & “The Power to Be Your Best”","Business","",""
"1","Apprentice","A person who works with a skilled tradesman to gain experience is an ___. (10 letter word)","Language","",""
"1","Apprentice","Donald Trump hosted the TV show, ""The _____"" for 12 years.","People","",""
"1","Aquarium","An ____ is a container where people keep fish and other water animals.","Language","",""
"1","Aquarius","What name of the zodiac is represented by the 'water carrier'?","Language","",""
"1","Arabia","Complete the title of the Best Picture Oscar winner for the year 1962: ""Lawrence of _____""","Film","",""
"1","Arabic","What is the official language in Egypt?","Language","",""
"1","Aramis","Which of the 'Three Musketeers' always wore black and eventually became a monk?","Literature","",""
"1","Arbuckle","On September 5,1921 the 'Fatty ____ Scandal' took place in San Francisco.","Dates","",""
"1","Arch","In architecture a curved or pointed opening that spans a doorway or window is called an ____.  (4 letters)","Art/Culture","",""
"1","Architect","Frank Lloyd Wright was a noted ___.","People","",""
"1","Architect","The Fountainhead' is about a man's struggle for success. What was his profession?","Literature","",""
"1","Arctic","The ____ Ocean is the smallest ocean.","Geography","",""
"1","Arden","In the comics Flash Gordon's girlfriend was named Dale ____.","Literature","",""
"1","Are","Complete the book title with one word. ""Where the Wild Things ____""","Literature","",""
"1","Argentina","A cardinal from this country became Pope Francis.","Geography","",""
"1","Argentina","In what country would you most likely find 'gauchos'?","Geography","",""
"1","Argentina","What country is the setting for the musical ""Evita""?","Music","",""
"1","Argentina","What large country is to the east of Chile?","Geography","",""
"1","Argo","Name the Best Movie of the Year Oscar winner for 2012.  (1 word of 4 letters)","Film","",""
"1","Argument","According to superstition, crossed knives and forks after dinner will cause an  ____. (8 letter word)","Language","",""
"1","Aria","A solo song in an opera is called an ____. (4 letters)","Music","",""
"1","Arizona","On October 10,1971 London Bridge was rededicated in Lake Havasu, ___.","Dates","",""
"1","Arizona","On October 25,1881 the 'Shootout at the OK Corral' took place in Tombstone, ___.","Dates","",""
"1","Arizona","The “Lost Dutchman Mine” is believed to be located in the 'Superstition Mountains' in this state.","Geography","",""
"1","Arizona","This battleship is a monument at Pearl Harbor.","History","",""
"1","Arizona","What state of the U.S. is next alphabetically after 'Alaska'?","Geography","",""
"1","Arkansas ","What state of the U.S. is next alphabetically after 'Arizona'?","Geography","",""
"1","Arm","What one 3-letter word can have both meanings?  A body part...To provide with weapons.","Language","",""
"1","Armistice","On November 11,1918 an _____ was declared during WWI. (9 letter word)","Dates","",""
"1","Arrows","What is kept in a 'quiver'?","Language","",""
"1","Arthur","He pulled a sword out of a stone and became king. (6 letter first name)","Literature","",""
"1","Arthur Miller","Who was the playwright who married Marilyn Monroe? (Initials A.M.)","People","",""
"1","Artist","James Whistler was a noted American _____.  (6-letter word)","Art/Culture","",""
"1","As Time Goes By","Name the song title : ‘You must remember this, a kiss is just a kiss'. (4 words)","Music","",""
"1","Asia","On what continent is Nepal?","Geography","",""
"1","Asphalt","What is the black material on most roads?","Language","",""
"1","Astros","American League baseball team: Houston _____.","Sports/Games","",""
"1","Atheism","The rejection of the concept of 'God' is ____.","Language","",""
"1","Athens","If Thessaloniki is the country's second largest city what city is the largest?","Geography","",""
"1","Athletics","American League baseball team: Oakland _____.","Sports/Games","",""
"1","Atlantic City","The standard Monopoly board locations are based in what city?","Geography","",""
"1","Atlantic Ocean","What were Arthur Whitten-Brown and John Alcock first to fly across non-stop?","History","",""
"1","Attic","The part of a house directly below a peaked roof is an ____. (5 letters)","Language","",""
"1","Attila","Provide the missing name of the historical person. “_____ the Hun”","History","",""
"1","Audrey Hepburn","In the film ""My Fair Lady"" (1964) Eliza Doolittle was portrayed by ____. (Initials A.H.)","Film","",""
"1","Auschwitz","The two best-known Nazi concentration camps were 'Dachau' and ____.","History","",""
"1","Australia","The 'Black Swan' is native to ____.","Science","",""
"1","Australia","The only continent where glaciers are not found is ____.","Geography","",""
"1","Australia","This country's largest lake is Lake Eyre.","Geography","",""
"1","Australia","What country dominated tennis during the 50's and 60's?","Sports/Games","",""
"1","Australia","What country has a federal territory named the ""Northern Territory""?","Geography","",""
"1","Australia","What country is identified with the 'boomerang'?","Geography","",""
"1","Austria","The local name for the country is ""Österreich"".  What is the common name? ","Geography","",""
"1","Author","Complete the title; 'Six Characters in Search of an ______'.","Literature","",""
"1","Ava Gardner","She married Mickey Rooney, Artie Shaw and Frank Sinatra. (Initials A.G.)","People","",""
"1","Available","Provide the missing word. ' Work expands so as to fill the time ______.'","Language","",""
"1","Avalanche","National Hockey League team name: ""Colorado ____"".","Sports/Games","",""
"1","Avis","What company tries harder because it is number two?","Business","",""
"1","Axe","In playing cards the King of Diamonds is also known as 'The Man with the ___'.","Sports/Games","",""
"1","Axis","The imaginary line through the earth, joining the 2 poles is the ___.","Geography","",""
"1","B-29","The bomber that dropped the first atomic bomb on Japan was a Boeing _____ Superfortress.","History","",""
"1","Babe","What was the name of Paul Bunyan's blue ox?","Literature","",""
"1","Babe Ruth","This player with the 1927 N.Y. Yankees slammed 60 home runs in the regular season.","Sports/Games","",""
"1","Baby","Complete the title of the Best Picture Oscar winner for the year 2004: ""Million Dollar _____""","Film","",""
"1","Baby","The name 'Gerber' is associated with _____ food","Language","",""
"1","Baby","Use 1 word to complete the title of the popular song: 'You Must Have Been a Beautiful _____'.","Music","",""
"1","Bach","Johann Sebastian ____composed the six ""Brandenburg Concertos"".","Art/Culture","",""
"1","Bachelor","The letters 'B.A.' after one's name means ""_____ of Arts"".","Language","",""
"1","Back","Provide the full form of the internet abbreviation: ""BAK"".","Language","",""
"1","Bag","Use 1 word to complete the common expression:' Let the cat out of the_____.'","Language","",""
"1","Bagheera","What was the name of the panther in 'The Jungle Book'?","Literature","",""
"1","Bagpipes","This wind instrument is associated with Scotland.","Music","",""
"1","Baines","For what did the ""B"" stand in the initials ""LBJ""?","History","",""
"1","Bake","Complete the word-pair: ""Shake and ____""","Language","",""
"1","Baker","Anagrams: Rearrange all of the letters in the word to make another word. BREAK","Language","",""
"1","Baker","Sherlock Holmes resided at 221B _____ Street.","Literature","",""
"1","Bakker","On March 19, 1987 Reverend Jim _____ resigned as head of the PTL Club.","Dates","",""
"1","Balance","Only female gymnasts compete on the '____ beam'.","Sports/Games","",""
"1","Balance","The amount of money left in a bank account is called the ___.","Language","",""
"1","Balboa","In the 1976 film ""Rocky"", Rocky's last name was ____.","Film","",""
"1","Balboa","Who is considered to be the first European to see the Pacific Ocean?","History","",""
"1","Bald","The "" ______ eagle"" is the national bird of the United States.","History","",""
"1","Balk","An illegal act by the pitcher entitling all runners to advance one base is called a ___.","Sports/Games","",""
"1","Ball","What one 4-letter word can have both meanings?  A formal event involving dancing...A baseball pitch that is not a strike.","Language","",""
"1","Ballet","On June 30,1974 ____ dancer Mikhail Baryshnikov defected while on tour in Canada. (6 letter word)","Dates","",""
"1","Ballets","Two classical ____ are ""Swan Lake"" and ""The Nutcracker"". (7-letter plural word)","Art/Culture","",""
"1","Bambi","In this Disney film a fawn grows up to become the “Great Prince of the Forest”.   ","Film","",""
"1","Bananas","""_______"" is the only Woody Allen film with a fruit as the title","Film","",""
"1","Bank","Where does a 'teller' work?","Language","",""
"1","Bankrupt","A company that is unable to pay its debts is said to be ____.","Language","",""
"1","Banquo","This character appears as a ghost at the banquet in 'Macbeth'.","Literature","",""
"1","Banzai","The Japanese battle cry during WWII was ____.","History","",""
"1","Baptism","This religious act cleanses one of original sin through application of water.","Language","",""
"1","Barabbas","This murderer was released by Pilate instead of Jesus.","Literature","",""
"1","Barack Obama","In 2013 _____was inaugurated to his second term as US President. (First and Last name)","People","",""
"1","Barbecue","An outdoor stove that often uses charcoal is a ____.","Language","",""
"1","Barbells","In weightlifting the weights to be lifted are called ____.","Sports/Games","",""
"1","Barber","A pole with red and white stripes usually indicates a ____ shop.","Language","",""
"1","Barber","Opera title: ""The ____ of Seville"".","Music","",""
"1","Barbie ","""____ doll"" is the world's largest selling doll.","Sports/Games","",""
"1","Barbie ","Fads: This doll’s boyfriend was named Ken.","Art/Culture","",""
"1","Bark","The outermost layer of the trunk of a tree is called the ____. (4 letter word)","Science","",""
"1","Bark","What one 4-letter word can have both meanings? Sound made by a dog...Covering on a tree.","Language","",""
"1","Barometer","What instrument is used to measure atmospheric pressure?","Science","",""
"1","Barrel","Use 1 word to complete the common expression:' Like Shooting fish in a ____'.","Language","",""
"1","Baseball","In what sport is the term 'balk' used?","Sports/Games","",""
"1","Baseball","In what sport is the term 'bullpen' used?","Sports/Games","",""
"1","Baseball","In what sport is there an 'E.R.A.' statistic?","Sports/Games","",""
"1","Baseball","In what sport might a player back up onto the 'warning track'?","Sports/Games","",""
"1","Baseball","On January 29, 1936 the _____ Hall of Fame was established.","Dates","",""
"1","Basketball","In what sport is the famous athlete associated? LeBron James","Sports/Games","",""
"1","Basketball","In what sport is the term often used? ""Full-court press""","Sports/Games","",""
"1","Basketball","In what sport is the term often used? ""Slam dunk""","Sports/Games","",""
