"1","0","George Washington, ""The Father of Our Country"" fathered how many children?","History","",""
"3","Blondin","Charles ____ was the first person to cross Niagara Falls on a tightrope.","People","",""
"3","Blood cells","What does the bone marrow manufacture? (2 word answer)","Science","",""
"3","Blue Peter","What is the name of the flag that a ship hoists before leaving the harbor? (2 word answer)","Language","",""
"3","Bluebird","On. January 4,1960 Donald Campbell died in this speedboat attempting to set a speed record","Dates","",""
"3","Blue-Tail Fly","""Jimmy crack corn, and I don't care"" is from what song?","Music","",""
"3","Bob Feller","In 1940 this pitcher had the first opening day no-hit, no-run game. (Initials B.F.)","Sports/Games","",""
"3","Bob Gibson","On July 18, 1974 he became the first American league pitcher to amass 3000 strikeouts. (Initials B.G.)","Dates","",""
"3","Bobby Riggs","Who lost to Billie Jean King in 'The Match of the Century'? (Initials B.R.)","Sports/Games","",""
"3","Bobby Vinton","His hits include 'Roses are Red' and 'Blue Velvet'. (Initials B.V.)","Music","",""
"3","Bocelli","Blind singer Andrea _____  had an album called 'Romanza' that went platinum.","Music","",""
"3","Boer","On October 11,1899 the ""____ War"" began.","Dates","",""
"3","Bok choy","Chinese white cabbage is also known by this name.","Language","",""
"3","Bolero","In the film '10' George and Jenny make love to the song ____.","Film","",""
"3","Bolivia","In what country was Che Guevara killed in 1967?","History","",""
"3","Bolivia","On February 5,1983 Nazi Klaus Barbie was extradited from ___ to France to stand trial.","Dates","",""
"3","Bolivia","South America has 2 landlocked countries. One is Paraguay and the other is _____.","Geography","",""
"3","Bolivia","The largest city in this country is ""Santa Cruz de la Sierra"".","Geography","",""
"3","Boll weevil","This insect is the most destructive to cotton. (2 words)","Science","",""
"3","Bolts","Arrows are used in archery. What is used with a crossbow?","Sports/Games","",""
"3","Bon Ami","What product used the slogan? ""Hasn't scratched yet""","Business","",""
"3","Bones","Sharks and rays have cartilage but no _____.","Science","",""
"3","Bonnie and Clyde","This 1967 film was advertised as, 'They're young..they're in love..and they kill people'. (3-word title)","Film","",""
"3","Bonspiel","By what name is a curling competitions known? (8 letters)","Sports/Games","",""
"3","Borgnine","Ernest _______  plays the title role in 'Marty', the Oscar-winning film of 1955.","Film","",""
"3","Borneo","About half of Malaysia is situated on this island.","Geography","",""
"3","Boston Massacre","Crispus Attucks was killed in this clash with British troops in 1770. (2 word answer)","History","",""
"3","Boston Tea Party","What historic event took place on December 16,1773? (3 word answer)","Dates","",""
"3","Botticelli","Identify the artist who painted the work.  ""The Birth of Venus” (Only last name required. Starts with 'B')","Art/Culture","",""
"3","Bottom","Which character wore the head of an ass in 'A Midsummer Night's Dream'?","Literature","",""
"3","Botulism ","_____is  a serious illness caused by eating preserved food that contains harmful bacteria. It often causes death","Science","",""
"3","Bough","""The Golden ____"" is a famous anthropological odyssey written by James Frazer. ","Literature","",""
"3","Boy Scouts","On Feb.8,1910 the ""____ of America"" was incorporated. ( 2 words)","Dates","",""
"3","Boyle's","""____ Law"" deals with the relation between the volume of a gas and pressure.","Science","",""
"3","Boys Town","Mickey Rooney's breakthrough as a dramatic actor came in this 1938 film opposite Spencer Tracy.","Film","",""
"3","Brady","White House Press Secretary James ___ was wounded in the assassination attempt on Reagan's life. ","History","",""
"3","Brahe","Dane Tycho ______ was the last of the naked-eye astronomers. ","Science","",""
"3","Brahma","_____ is the Hindu god of creation.","Literature","",""
"3","Braise","What is the cooking term meaning to brown meat slowly in hot fat? (6 letter word)","Language","",""
"3","Brannock","Provide the inventor's name. A device for measuring a person’s shoe size.    ""_____ device""","Science","",""
"3","Brazil","On November 15,1889 Pedro II abdicated and ___ was declared a republic.","Dates","",""
"3","Brazil","What is the world's fifth largest country and the sixth most populous?","Geography","",""
"3","Breadfruit","The cargo carried by the 'Bounty' at the time of the mutiny was '____ trees'.","History","",""
"3","Breakfast at Tiffany's","In what non-musical film was the song 'Moon River' featured? (3 word title)","Film","",""
"3","Breaking Bad","On what TV series was Blue crystallized methamphetamine of significance? (2 word title)","TV","",""
"3","Bridgeport","What is the largest city, by population, in Connecticut?","Geography","",""
"3","Britannia","On April 16,1953 this British royal yacht was launched.","Dates","",""
"3","Britten","Benjamin ____ was an English composer, conductor and pianist. (7 letter surname)","People","",""
"3","Brooke","English poet Rupert ______ died at age 27 while on his way to the landing at Gallipoli in 1915.","People","",""
"3","Brooks","Albert _____ portrayed the husband who dies on the wedding night in 'Private Benjamin'. ","Film","",""
"3","Brooks","In 1990 at age 28 Garth _____ became the youngest member of Nashville's 'Grand Ole Opry'. ","Music","",""
"3","Brown","Canadian pilot Roy _____ claimed victory over the Red Baron.","History","",""
"3","Brown","On May 17,1954 the Supreme Court ruled against segregated schools in ""________ vs Bd. of Education"".","Dates","",""
"3","Browning","“The Barretts of Wimpole Street” is based on the romance of Robert _______ and Elizabeth Barrett.","Literature","",""
"3","Bruce","King Robert I of Scotland was also known as ""Robert the ____"".","People","",""
"3","Bruce","What did the crew nickname the mechanical shark used in 'Jaws' (1975)? (5 letters)","Film","",""
"3","Brummel","English dandy and wit George Bryan ____  is credited with inventing trousers to replace breeches.","People","",""
"3","Brussels","If Antwerp is the country's second largest city what city is the largest?","Geography","",""
"3","Brussels","On May 29,1985 38 were killed in a soccer riot at Heysel Stadium in this city.","Dates","",""
"3","Brylcreem","What product used the slogan? ""A Little dab'll do ya"".","Business","",""
"3","Bucephalus","What was the name of the horse of Alexander the Great?","History","",""
"3","Buchanan","James _____  preceded Abraham Lincoln as president.","History","",""
"3","Buck","The first starring movie of Abbott and Costello was ""_____ Privates"".   ","Film","",""
"3","Bucket","In “Charlie and the Chocolate Factory”, what is Charlie’s surname?","Literature","",""
"3","Buckley","William F. _____ was the principal founder of the  “National Review” magazine. ","Business","",""
"3","Buddy Ebsen","Who was originally cast to portray the Tin Woodsman in the 1939 film, 'The Wizard of Oz'? (Initials B.E.)","Film","",""
"3","Buddy Holly","Don McLean's classic 'American Pie' was a lament about the death of ___. (Initials B.H.)","Music","",""
"3","Buick","In 'Annie Hall' Alvy said the spider in Annie's bathroom was 'the size of a ___'.","Film","",""
"3","Bulova","On July 1, 1941 the first USA TV commercial was broadcast. It showed a ""___ "" watch..","Dates","",""
"3","Burberry","What brand of belted raincoat is known for its distinctive tartan lining? (8 letter word)","Art/Culture","",""
"3","Buren","Twin sisters Ann Landers and Abigail Van _____ both wrote popular “advice” columns.","People","",""
"3","Burlington","Name the largest city (by population) in Vermont.","Geography","",""
"3","Burroughs","Author William S. _______ accidentally shot and killed his wife.","People","",""
"3","Burt Bacharach","What person with the double initials ""B.B.""  was once married to Angie Dickinson? ","People","",""
"3","Bush baby","What is the more common name for the African lemur 'Galago'? (2 words)","Science","",""
"3","Business","Canadian rock band, ""Bachman Turner Overdrive""  had a hit with, “Takin’ Care of ______”.","Music","",""
"3","Butcher","The bird known as the 'shrike' is also known as the ""____ bird"".","Science","",""
"3","Cadillac","The City of Detroit was founded by ____. (Last name only)","History","",""
"3","Caesarion","What was the name of Julius Caesar’s son by Cleopatra?","History","",""
"3","Cajuns","Descendants of the French settlers from Canada who settled in Louisiana are called ____.","History","",""
"3","Calabash","Jimmy Durante ended his TV show with, “Good Night, Mrs. ____”","TV","",""
"3","Calder","American sculptor Alexander ____ was known for his mobiles.","Arts/Culture","",""
"3","Caldera","What is the term for a larger crater formed when the top of a volcano is exploded away?","Geography","",""
"3","Call","What is the first word of Melville's ""Moby Dick""?  (4 letter word)","Literature","",""
"3","Calley","On March 29,1971 William _____ was found guilty of murder of civilians during the My-Lai massacre.","Dates","",""
"3","Calpurnia","Julius Caesar’s third and last wife was named _____.","History","",""
"3","Calvary","What Biblical hill is also known as ""Golgotha""? (7 letters","Literature","",""
"3","Calvin Coolidge","What president said, 'When more and more people are thrown out of work, unemployment results'? (Initials C.C.)","People","",""
"3","Camptown Races","What song contains, ""I'll bet my money on de bobtail nag""? (two words)","Music","",""
"3","Canada","The first Lexus built outside Japan was in this country.","Business","",""
"3","Cannery Row","This 1944 Steinbeck novel is set in Monterey, California. (2 words)","Literature","",""
"3","Canon","The body of codified laws governing the affairs of a Christian church is called ""_____ law"".  (5 letter word)","Art/Culture","",""
"3","Canterbury","Name the city in which the assassination of Thomas Becket occurred in 1170.","Geography","",""
"3","Cantonese","The two major dialects of the Chinese language are Mandarin and _____.","Language","",""
"3","Canute","According to legend, King _____ tried to turn back the sea.","Literature","",""
"3","Capital Expenditure","The business abbreviation ""CAPEX"" stands for ______.","Business","",""
"3","Capp","Al ____ created the comic-strip character 'Fearless Fosdick'.","Literature","",""
"3","Captain Kangaroo","For what TV role was Bob Keeshan best known?","TV","",""
"3","Captures","In chess notation what does the 'x' signify in 'Q x R'? (8 letters)","Sports/Games","",""
"3","Capybara","What is the world’s largest rodent? (8 letters)","Science","",""
"3","Caracas","If Maracaibo is the country's second largest city, what city is the largest?","Science","",""
"3","Caraway","The liqueur 'Aquavit' has the flavor of ____ seeds.","Science","",""
"3","Carbon","What element forms the most compounds?","Science","",""
"3","Carbonic acid","Carbon dioxide dissolves in water to form ____.","Science","",""
"3","Cardigan","Lord ______ led the “Charge of the Light Brigade”.","History","",""
"3","Cardinal Richelieu","Who was nicknamed the 'Red Eminence'?  (2 words)","History","",""
"3","Cards","Wire-toothed brushes for combing and cleansing wool before it is spun into yarn are called ____.","Business","",""
"3","Carillon","What word refers to a set of stationary bells rung by hammers operated from a keyboard? (8 letter word)","Music","",""
"3","Carlo Ponti","In Paris on April 9, 1966 Sophia Loren married this man although he was still married. (Initials C.P.)","Dates","",""
"3","Carmen Miranda","This singer, dancer’s trademark was a huge hat filled with fruit. (Initials C.M.)","People","",""
"3","Carnarvon","The ""Earl of _____"" died because of the so-called “Curse of the Pharaohs” after a mosquito bite.","People","",""
"3","Carnera","On June 29,1933 Primo ___ knocked out Jack Sharkey to become heavyweight champion. ","Dates","",""
"3","Carol Channing","Who played the original role of Dolly Levi in “Hello Dolly”?","Art/Culture","",""
"3","Carole King","What artist is most closely associated with the lyrics?  “One of us is changing, or maybe we've stopped trying” (Initials C.K.)","Music","",""
"3","Carole King ","What artist is most closely associated with the lyrics?  “Doesn't anybody stay in one place any more?” (Initials C.K.)","Music","",""
"3","Carousel","What 1956 film featured the song, 'If I Loved You'?","Film","",""
"3","Carpathia","What ship picked up most of the 'Titanic' survivors?","History","",""
"3","Carpe diem","This 2 word Latin aphorism is usually translated as ""seize the day"".","Arts/Culture","",""
"3","Carpetbaggers","Following the Civil war, this term was applied to politicians and others from the North.","History","",""
"3","Carriage","The Deacon's Masterpiece' in the poem of the same name was a _____. (8-letter word)","Literature","",""
"3","Carry Nation","Between 1900-1910 she was arrested some 30 times for “hatchetations”. (Initials C.N.) ","People","",""
"3","Cartel","What 6-letter term best describes “OPEC”?","Business","",""
"3","Carter","King Tut's tomb was located in Egypt in 1922 by Howard _____.","History","",""
"3","Cartier","His exploration of the St. Lawrence laid the basis for French claims to Canada. (Surname only)","History","",""
"3","Cartilage","A shark's skeleton is made of _____.","Science","",""
"3","Cartland","Dame Barbara ____ is known for her numerous romantic novels.","Literature","",""
"3","Casey at the Bat","Name the source: 'It looked extremely rocky for the Mudville nine that day'. (4 words)","Literature","",""
"3","Casino","The 2 of spades playing card is known as, ""Little _____"".","Sports/Games","",""
"3","Caspar","The PGA Player of the Year for 1966, 1968 and 1970 was Billy ____.","Sports/Games","",""
"3","Cassandra","This mythical Greek prophetess's predictions, though true, were never believed.","Literature","",""
"3","Cassatt","American painter Mary ____ is best known for her pictures of mothers and children.","Arts/Culture","",""
"3","Castle Walk  ","Vernon and Irene Castle introduced this dance.  (2 words)","Art/Culture","",""
"3","Cat","A draw in a game of tic-tac-toe is called a ___.","Sports/Games","",""
"3","Catalyst","A substance that changes the speed of a chemical reaction without being affected is a ___.","Science","",""
"3","Catharsis","A purifying of the emotions is a _____. (9-letter word that starts with 'c'.)","Language","",""
"3","Catherine Howard","Henry VIII beheaded his fifth wife. What was her name? (Provide first and last name.)","History","",""
"3","Catherine Howard","Henry VIII had 2 of his wives executed: Anne Boleyn and ____. (Provide first and last name.) ","People","",""
"3","Cathode","Term for the positively charged terminal of a primary cell or a storage battery that is supplying current. (7 letters)","Science","",""
"3","Cato","Roman Marcus ____ ended every speech by saying, 'Carthage must be destroyed'. ( 4 letter name)","People","",""
"3","Cave","Where would one expect to find a 'speleologist' at work? (4 letter word)","Geography","",""
"3","Cavell","English nurse Edith ____ was executed in 1915 by the Germans.","History","",""
"3","Cayce","Seer Edgar ____ is reputed to have predicted the 929 stock market crash and WWII. (5 letter name)","People","",""
"3","Cayman","The ""____ Islands"" is a  tax haven known as the 'Switzerland of the Caribbean'.","Geography","",""
"3","Cd","What is the symbol for the element CADMIUM?","Science","",""
"3","Cedar","What type of tree is on the flag of Lebanon? (5 letters)","Geography","",""
"3","Celine Dion","Whose best-selling album of 1997 was titled, 'Let's Talk About Love'?  (Initials C.D.)","Music","",""
"3","Cell","Robert Hooke coined this 4-letter term for describing biological organisms","Science","",""
"3","Cenozoic","What era of the Earth are we now in?","Science","",""
"3","Center","Provide the missing word. ""Things fall apart; the ____ cannot hold"".","Literature","",""
"3","Centrifuge","This apparatus is used to separate 2 liquids by high speed rotation. (10-letter word)","Science","",""
"3","Centripetal","""_____ force""  is the term for the inward force of a rotating body.","Science","",""
"3","CERN","By what 4-letter name is the “European Organization for Nuclear Research” known?","Science","",""
"3","Chachi","TV show title of 1982-83: “Joanie Loves ____”","TV","",""
"3","Chamonix","On January 25,1924 the first winter Olympics were held at this site in France.","Dates","",""
"3","Champlain","Burlington, Vermont is on Lake ____.","Geography","",""
"3","Champlain","Quebec City was founded by _____.","History","",""
"3","Chanel","Fashion designer Gabrielle Bonheur ____ was the subject of the Broadway musical ""Coco"". (6 letter name)","People","",""
"3","Chang","Who was the twin brother of the original Siamese twin Eng? (5 letter name)","People","",""
"3","Chapman","The real name of ""Johnny Appleseed"" was John ____.","People","",""
"3","Character","Provide the missing word. ""If wealth is lost, nothing is lost. If health is lost, something is lost. If ____ is lost, everything is lost.""","Language","",""
"3","Charles Bronsin","This actor and husband of Jill Ireland was known as 'Il Brutto' (the ugly one) in Italy. (Initials C.B.)","People","",""
"3","Charles Lindbergh","On June 11, 1927 ____ received the first Distinguished Flying Cross, a medal for heroism. (Initials C.L.)","Dates","",""
"3","Charles Lindbergh","Who was 'Time Magazine's' first Man-of-the-Year in 1927? (Initials C.L.)","History","",""
"3","Charlie Chaplin","The remains of this famous star were dug up and held for ransom. (Provide first and last name.) ","People","",""
"3","Chaucer","This man is known as the 'Father of English Poetry'.","Literature","",""
"3","Chávez","Labor leader César _____ founded the “United Farm Workers” union. ","People","",""
"3","Checkers","The traditional rule of 'huff or blow' is found in what game?","Sports/Games","",""
"3","Cheek","Provide one word to complete the line. “O that I were a glove upon that hand, that I might touch that ____!”","Literature","",""
"3","Cheers","What TV series had an episode titled: ""Woody for Hire Meets Norman of the Apes""?","TV","",""
"3","Cheetah","What is the only member of the cat family without retractable claws?","Science","",""
"3","Chemin de fer","The name of this game literally means 'Railway'. (3 words)","Sports/Games","",""
"3","Chemistry","Antoine Laurent Lavoisier is known as the, “Father of Modern ____”.","Science","",""
"3","Cherokee","Sequoya is noted for having created an alphabet for the ___ nation.","Language","",""
"3","Chess","In what game might you employ a 'Ruy Lopez'?","Sports/Games","",""
"3","Cheval","In roulette a bet on 2 adjacent numbers on the table is called a ____. (6 letters)","Sports/Games","",""
"3","Cheviot","The ""____ Hills""  form the border between Scotland and England. (7 letters)","Geography","",""
"3","Chicago","Complete the film quotation with the name of a city. “This is ____ kid. You can’t beat fresh blood on the walls.”","Film","",""
"3","Chiffon ","What margarine used the slogan? ""It's not nice to fool Mother Nature""","Business","",""
"3","Child","Provide one word to complete the line. “How sharper than a serpent’s tooth it is to have a thankless ___!”","Literature","",""
"3","Childhood","""DACA"" stands for, ""Deferred Action for _____ Arrivals"". (9 letter word)","History","",""
"3","Chile","On Feb.12,1818, after 7 years of war, this South American country gained its independence.","Dates","",""
"3","Chinese","What nationality was “Aladdin”?","Literature","",""
"3","Chippendale","Thomas _____ was a famous English cabinetmaker and furniture designer. (11 letter name) (Not Thomas Sheraton)","People","",""
"3","Chlorine","On April 22,1915 the Germans used this poison gas for the first time at Ypres.","Dates","",""
"3","Choose","Provide the last word of the line of poetry. Walt Whitman: “The long brown path before me leading wherever I ____”.","Literature","",""
"3","Chopra","Celebrity author Deepak _____ wrote, 'The Seven Spiritual Laws of Success'.","Literature","",""
"3","Chopsticks","The original name of this simple piano piece was, “The Celebrated Chop Waltz”.","Music","",""
"3","Chord","Term for a straight line segment whose endpoints lie on a circle.","Science","",""
"3","Chordates","Humans are in the 'class' Mammals but what 'phylum' are we grouped under?","Science","",""
"3","Christa McAuliffe","What was the name of the teacher killed in the Challenger explosion? (Initials C.M.)","Science","",""
"3","Christian Science.","Mary Baker Eddy founded _____. (2 word answer)","Art/Culture","",""
"3","Christie Brinkley","Her husbands have included Jean Francois Allaux, Billy Joel, Rick Taubman and Peter Cook. (Initials C.B.)","People","",""
"3","Christine Keeler","Her affair with British minister of war John Profumo caused a scandal in 1963. (Initials C.K.)","People","",""
"3","Christopher Columbus","Who was 'Iberia's Pilot'? (Provide first and last name.) ","History","",""
"3","Chubby Checkers","He helped to popularize the 'Twist' craze of the 1960's.","Music","",""
"3","Chuck Berry","Whose first big hit was 'Maybellene'? (Initials C.B.) ","Music","",""
"3","Chuck Connors","Who played the title role in TV's ""The Rifleman""?  (Initials C.C.)","TV","",""
"3","Church","In Italy, if you are in a 'chiesa' you are in a ____.","Language","",""
"3","Churchyard","Title of a poem by Thomas Gray: ""Elegy Written in a Country _____"".","Arts/Culture","",""
"3","Cialis","Identify the sponsor by the slogan: ""Will you be ready?"".","Business","",""
"3","Cicadas","What is the proper name for '17-year locusts'?","Science","",""
"3","Circadian","Human beings and many living things follow an activity cycle known as ""_____ rhythm""","Science","",""
"3","Circuses","Phrase about the declining Roman Empire: ""Two things only the people anxiously desire - bread and ____.""","History","",""
"3","Cirques","Great basins carved out of valley walls by alpine glaciers are called ___","Geography","",""
"3","Cisco Kid","Duncan Renaldo was closely identified with his TV role as, ""The ________"". (2 words)","TV","",""
"3","Citizen Kane","The last spoken words of this film are,' Throw that junk in' (the fire).","Film","",""
"3","Citizens Band","For what did the letters stand in the radio frequency “CB”?","Science","",""
"3","Cl","What is the symbol for the element CHLORINE?","Science","",""
"3","Clarified","Melted butter with the sediment removed is said to be ____.","Language","",""
"3","Clark","Marcia _____ was the lead prosecutor in the O.J. Simpson murder trial.","History","",""
"3","Claude","The W.C. in W.C. Fields stood for William ___.","Film","",""
"3","Claude Debussy","What composer's only opera was, ""Pellets et Melisandre"" (1902)   ( Initials C.D.)","People","",""
"3","Claude Monet","His painting, ""Impression, Sunrise"" gave the name to the impressionist movement. (Initials C.M.)","Arts/Culture","",""
"3","Claude Rains","Who portrayed Dr. Alexander Tower in the 1941 film 'King's Row'?   (Initials C.R.)","Film","",""
"3","Cleavage","Term for the tendency of minerals to split, leaving flat, smooth surfaces.","Science","",""
"3","Clemens","Mark Twain's real name was Samuel Langhorne _____.","Literature","",""
"3","Clement Atlee","On July 5,1945 Winston Churchill lost the election for prime minister to this man.  (Initials C.A.)","Dates","",""
"3","Clenched fist","Complete the quotation by Indira Gandhi: You cannot shake hands with a _____ (2 words)","People","",""
"3","Cleveland","In 1967 Carl Stokes became the first black, elected mayor of a major U.S. city. Name the city.","History","",""
"3","Clocks","What were 'Nurnberg eggs'?","Language","",""
"3","Club Med","What holiday vacation company used the slogans? “Life as it should be” & “The antidote for civilization”","Business","",""
"3","Cm","What is the symbol for the element CURIUM?","Science","",""
"3","Coat hanger","Albert Parkhouse is credited with inventing this device to help you keep your closet tidy. (2 words)","People","",""
"3","Coca Cola","What is Dr. John Pemberton credited with inventing? ( 2 words)","Science","",""
"3","Cocaine","The title 'The Seven Percent Solution' refers to ____.","Film","",""
"3","Cockney","Who is commonly said to be born within the sound of the 'Bow Bells'?","Geography","",""
"3","Cockroach","What insect is alluded to in the song, 'La Cucaracha'?","Music","",""
"3","Cocoa Krispies ","Identify the cereal represented by a lion named Snagglepuss. (2 words)","Business","",""
"3","Cogito, Ergo Sum","What is the Latin form of, ""I Think; therefore I am.""?","Science","",""
"3","Coleridge","Poet Samuel Taylor _____ received his inspiration for 'Kublai Khan' while under the influence of opium. ","Literature","",""
"3","Collide","Philip Wylie authored the novel, ""When Worlds ____"".","Literature","",""
"3","Colm Wilkinson","Who played the original role of Jean Valjean in the original English language production of, “Les Misérables” in London?","Art/Culture","",""
"3","Colombo","Sri Lanka’s largest city and a major port.","Geography","",""
"3","Colossus","The title of the poem inscribed on the pedestal of the Statue of Liberty is ""The New ____"".","History","",""
"3","Columbo","On what TV series was the car of significance? A 1959 Peugeot 403 convertible.","TV","",""
"3","Columbus","""______ Day"" was first celebrated as a federal holiday in the USA in the year 1937.","History","",""
"3","Coma","The head of a comet consists of the nucleus and this luminescent cloud surrounding it.","Science","",""
"3","Comet","Josephine the Plumber' promoted this cleanser.","Business","",""
